filename	language	family	reference_ipa
fleurs_swa_006.wav	Swahili	Atlantic-Congo	l a j t o n a l i k u w a a m e o m b a m a ɓ a ɗ i l i k o j a m s w a ɗ a w a k i m a z i n ɡ i ɾ a w a w a h a f i ð i n a w a k a t i w a m k u t a n o n a p m a k i o m b a u a n d i ʃ i u p j a w a u n d a n i n a m k a m i l i f u w a m s w a ɗ a w a k i m a z i n ɡ i ɾ a w a t͡ʃ a m a t͡ʃ a w a h a f i ð i n a
fleurs_swa_007.wav	Swahili	Atlantic-Congo	u a n d i ʃ i ɓ l o ɠ i n i k i f a a k i n a t͡ʃ o t͡ʃ o t͡ʃ e a u ʃ i ɾ i k i a n o n a k u h i m i z a w a n a f u n z i k u p a n u a u s o m a ʄ i z a i ɗ i j a s i k u j a k a w a i ɗ a j a m a s o m o ʃ u l e n i
fleurs_swa_008.wav	Swahili	Atlantic-Congo	k u n ɡ a l i k u n a w a n a u m e n a w a n a w a k e w e n ɡ i w a l i o h a i w a l i o i ʃ i m u ɗ a w a o h a p a n a w e n ɡ i n e w e n ɡ i a m b a o w a p e n d w a w a o w a l i u a w a a u w a l i f a ɲ i ʃ w a k a z i h a ɗ i k u f a w a j a h u ɗ i n a w a s i o w a j a h u ɗ i v i l e v i l e
fleurs_swa_009.wav	Swahili	Atlantic-Congo	k i l a k i t u k a t i k a u l i m w e n ɡ u k i m e u n d w a k u t o k a n a n a ɗ u t u ɗ u t u z o t e z i m e u n d w a k u t o k a n a n a t͡ʃ e m b e n d o ɠ o n d o ɠ o z i n a z o i t w a a t o m i
fleurs_swa_010.wav	Swahili	Atlantic-Congo	m ʃ a ɓ a h a u l i o p o k a t i j a p a θ o l o ʄ i a j a u ɓ o n ɡ o n a t a ɓ i a i n a u n ɡ a m k o n o w a n a s a j a n s i k a t i k a u t a f i t i w a o
fleurs_swa_011.wav	Swahili	Atlantic-Congo	h a t a h i v j o a s i l i m i a j a x ɗ ɾ t ɓ k a t i k a k i k u n d i k i z i m a t͡ʃ a w a t u w e ɲ e k i f u a k i k u u ɓ a ɗ o i n a o n e k a n a k u w a t͡ʃ i n i w a t u k a t i j a w a l i o a m b u k i z w a k w a w a k a t i w o w o t e m a a l u m u k a t i k a a f ɾ i k a k u s i n i
fleurs_swa_012.wav	Swahili	Atlantic-Congo	o f i s i j a u ð i ɓ i t i w a ð a ɾ u ɾ a j a m a ɾ i a n a s k a s k a z i n i i l i s e m a k w a m b a h a k u n a m a ð a ɾ a j a l i j o ɾ i p o t i w a k a t i k a t a i f a
fleurs_swa_013.wav	Swahili	Atlantic-Congo	m t a n d a o u n a t͡ʃ a n ɡ a ɲ a v i t u v j a m a w a s i l i a n o j a k u n d i l a w a t u n a j a k a t i j a m t u n a m t u
fleurs_swa_014.wav	Swahili	Atlantic-Congo	p e ɾ ɾ j a l i s e m a n i t a ɾ u ɗ i t e x a s i l i k u t a θ m i n i m a t o k e o j a m k u t a n o w a u s i k u w a l e o k u a m u a k a m a k u n a n ɟ i a j a n ɡ u j a k u s o n ɡ a m b e l e k a t i k a m b i o h i z i l a k i n i ɓ a a ɗ a j e a k a s e m a k w a m b a a n ɡ e ɓ a k i k w e ɲ e m b i o n a k u ʃ i n d a n a k a t i k a u t͡ʃ a ɠ u z i w a m s i n ɡ i w a c a ɾ o l i n a k u s i n i m n a m o ʄ a n u a ɾ i
fleurs_swa_015.wav	Swahili	Atlantic-Congo	i l i k u ʄ i o n e a h o n ɡ k o n ɡ v i z u ɾ i z a i ɗ i o n d o k a k i s w a n i k i ʃ a u e l e k e e u p a n d e w a m w a m b a o w a k o w l o o n u l i o m k a ɓ a l a
fleurs_swa_016.wav	Swahili	Atlantic-Congo	h a k u w e z a k u ɲ w a ɗ a w a z i n a z o h i t a ʄ i k a k u t u l i z a m a u m i v u j a k e k w a n i z i m e p i ɠ w a m a ɾ u f u k u k a t i k a m i t͡ʃ e z o
fleurs_swa_017.wav	Swahili	Atlantic-Congo	w a n a s a j a n s i w a l i w e z a k u h i t i m i ʃ a k u w a u ɗ u s i m w e u s i u n a a θ i ɾ i u ɗ u s i m w i n ɡ i n e m w e u s i k w a n ɟ i a i l e i l e j a k a w a i ɗ a
fleurs_swa_018.wav	Swahili	Atlantic-Congo	k a m a m a t o k e o w a t e n d a ʄ i h u v u t a m i s o k o t o j a ɓ a n ɡ i k w e ɲ e ʄ u k w a a n a u k u m b i w e ɲ e w e u n a w a h i m i z a h a ð i ɾ a k u ʃ i ɾ i k i
fleurs_swa_019.wav	Swahili	Atlantic-Congo	ɓ o m u h i i ɠ a w a ɲ i k i h u f a ɲ a k a z i k w a k a n u n i k w a m b a n ɡ u v u h u h i t a ʄ i k a k a t i k a u u n d a ʄ i w a v i i n i v j e ɲ e p ɾ o t o n i n a n u t ɾ o n i ɲ i n ɡ i
fleurs_swa_020.wav	Swahili	Atlantic-Congo	a t o m u z i n ɡ i n e h u w a n a v i i n i v i s i v j o i m a ɾ a k w a m a a n a k w a m b a h u w a n a m a z o e a j a k u a t͡ʃ a n a h a t a k w a m ɠ u s o k i ɗ o ɠ o t u
fleurs_ind_001.wav	Indonesian	Austronesian	t i m t i m f i r t u a l m ə m i l i k i s t a n d a r k ə u ŋ ɡ u l a n j a ŋ s a m a d ə ŋ a n t i m k o n f ə n s i o n a l t ə t a p i a d a s ə d i k i t p ə r b ə d a a n
fleurs_ind_002.wav	Indonesian	Austronesian	s ə ɡ ə r a s ə t ə l a h p ə r m u s u h a n p ə t͡ɕ a h b r i t a n i a m ə m u l a i b l o k a d ə l a u t d͡ʑ ə r m a n
fleurs_ind_003.wav	Indonesian	Austronesian	s ə m u a n o m i n a d i s a m p i ŋ k a t a s i ə u n t u k a n d a s ə l a l u d i m u l a i d ə ŋ a n h u r u f k a p i t a l b a h k a n d i t ə ŋ a h k a l i m a t
fleurs_ind_004.wav	Indonesian	Austronesian	i n i s ə p ə r t i ɲ a m a s u k a k a l k a r ə n a b u m i t i d a k t ə r a s a s ə p ə r t i b ə r ɡ ə r a k b u k a n b ə ɡ i t u
fleurs_ind_005.wav	Indonesian	Austronesian	d i s i s i l a i n k o n d i s i j a ŋ d i ŋ i n d a n b ə r s a l d͡ʑ u t ə r ɡ o l o ŋ n o r m a l d i b a ɲ a k n ə ɡ a r a d a n l a l u l i n t a s t ə r u s b ə r l a n d͡ʑ u t t a n p a ɡ a ŋ ɡ u a n s ə p a n d͡ʑ a ŋ t a h u n
fleurs_ind_006.wav	Indonesian	Austronesian	k a m b i ŋ t a m p a k ɲ a m u l a i d i d͡ʑ i n a k k a n s ə k i t a r t a h u n l a l u d i p ə ɡ u n u ŋ a n z a ɡ r o s d i i r a n
fleurs_ind_007.wav	Indonesian	Austronesian	d i k ə p u l a u a n d a n d a n a u a n d a t i d a k p ə r l u k a p a l p ə s i a r
fleurs_ind_008.wav	Indonesian	Austronesian	p ə m b ə r i t a h u a n r ə ɡ u l ə r d i m ə t r o h a ɲ a m ə ŋ ɡ u n a k a n b a h a s a k a t a l a n t ə t a p i ɡ a ŋ ɡ u a n t a k t ə r ə ɲ t͡ɕ a n a d i u m u m k a n l ə w a t s i s t ə m o t o m a t i s d a l a m b ə r b a ɡ a i b a h a s a a n t a r a l a i n s p a ɲ o l i ŋ ɡ r i s p r a ɲ t͡ɕ i s a r a b d a n d͡ʑ ə p a ŋ
fleurs_ind_009.wav	Indonesian	Austronesian	i n i a d a l a h s a l a h s a t u a t r a k s i u t a m a a f r i k a s ə l a t a n d a n d i a ŋ ɡ a p s ə b a ɡ a i a n d a l a n t a m a n n a s i o n a l a f r i k a s ə l a t a n s a n p a r k s
fleurs_ind_010.wav	Indonesian	Austronesian	m ə r ə k a m ə m i l i k i k a k i d ə ŋ a n s i s i k d a n t͡ɕ a k a r b ə r t ə l u r d a n b ə r d͡ʑ a l a n d ə ŋ a n d u a k a k i b ə l a k a ŋ s ə p ə r t i t r ə k s
fleurs_ind_011.wav	Indonesian	Austronesian	d i a d͡ʑ u ɡ a t ə r l i b a t d a l a m p ə ŋ u k i r a n u a ŋ k ə r t a s u n t u k b a ɲ a k n ə ɡ a r a t͡ɕ o n t o h k a r j a ɲ a j a ŋ t ə r b a r u t ə r m a s u k p o t r ə t p ə r d a n a m ə n t ə r i d i b a ɡ i a n d ə p a n u a ŋ k ə r t a s d a n k a n a d a j a ŋ b a r u
fleurs_ind_012.wav	Indonesian	Austronesian	o r a ŋ o r a ŋ t ə l a h m ə ŋ ə n a l u n s u r u n s u r k i m i a d a s a r s ə p ə r t i ə m a s p ə r a k d a n t ə m b a ɡ a d a r i z a m a n k u n o k a r ə n a s ə m u a i n i d a p a t d i t ə m u k a n d i a l a m d a l a m b ə n t u k a s l i ɲ a d a n r ə l a t i f m u d a h d i t a m b a ŋ d ə ŋ a n a l a t a l a t p r i m i t i f
fleurs_ind_013.wav	Indonesian	Austronesian	d i b a ŋ u n o l ə h o r a ŋ o r a ŋ m ə s i r p a d a a b a d k ə t i ɡ a s m p i r a m i d a a ɡ u ŋ m ə r u p a k a n s a l a h s a t u d a r i b a ɲ a k s t r u k t u r p i r a m i d a b ə s a r j a ŋ d i b a ŋ u n u n t u k m ə ŋ h o r m a t i f i r a u n j a ŋ t ə l a h m ə n i ŋ ɡ a l d u n i a
fleurs_ind_014.wav	Indonesian	Austronesian	s u l t a n m a r o k o m ə m b a ŋ u n k ə m b a l i k o t a t ə r s ə b u t m ə n d͡ʑ a d i d a r u i b a d j a k o t a t ə r s ə b u t k ə m u d i a n d i n a m a i t͡ɕ a s a b l a ɲ t͡ɕ a o l ə h p a r a p ə d a ɡ a ŋ s p a ɲ o l j a ŋ m ə n d i r i k a n b a s i s p ə r d a ɡ a ŋ a n d i s a n a
fleurs_ind_015.wav	Indonesian	Austronesian	w i s a t a w a n j a ŋ b ə p ə r ɡ i a n k ə n ə ɡ a r a n ə ɡ a r a b ə r p a d͡ʑ a k j a ŋ t i ŋ ɡ i k a d a ŋ k a d a ŋ b i s a m ə ŋ h ə m a t u a ŋ u n t u k p r o d u k p r o d u k s ə p ə r t i m i n u m a n b ə r a l k o h o l d a n t ə m b a k a u
fleurs_ind_016.wav	Indonesian	Austronesian	w a l a u p u n s ə r i ŋ k a l i i n i h a ɲ a s t ə r ə o t i p j a ŋ t i d a k a k u r a t t͡ɕ a r a t ə r b a i k u n t u k t ə t a p b ə r ɡ a u l d i p a r i s a d a l a h d ə ŋ a n b ə r p ə r i l a k u t ə r b a i k b ə r t i n d a k s ə p ə r t i s ə s ə o r a ŋ j a ŋ b i ə n ã l ə f ã d i b ə s a r k a n d ə ŋ a n b a i k h a l t ə r s ə b u t m ə m b u a t p ə r d͡ʑ a l a n a n b ə r k ə l i l i ŋ a n d a d͡ʑ a u h l ə b i h m u d a h
fleurs_ind_017.wav	Indonesian	Austronesian	t͡ɕ a s a b l a ɲ t͡ɕ a a d a l a h s a l a h s a t u t ə m p a t p a l i ŋ t i d a k m ə n a r i k u n t u k b ə r b ə l a n d͡ʑ a d i s ə l u r u h m a r o k o
fleurs_ind_018.wav	Indonesian	Austronesian	o r a ŋ o r a ŋ s ə k a r a ŋ m ə n u l i s p ə s a n d i l a j a r k o m p u t ə r t i d a k p ə r n a h h a r u s m ə ŋ ɡ u n a k a n r a u t a n
fleurs_ind_019.wav	Indonesian	Austronesian	n a m u n a d a b a ɲ a k h a l t ə n t a ŋ b u r u ŋ j a ŋ m a s i h t ə r l i h a t s ə p ə r t i d i n o s a u r u s
fleurs_ind_020.wav	Indonesian	Austronesian	i n s t i t u t k ə a d i l a n d a n d ə m o k r a s i h a i t i t ə l a h m ə r ə f ə r ə n s i k a n p ə n ə l i t i a n i n d ə p ə n d ə n j a ŋ m ə ŋ ə m u k a k a n b a t a l i o n p ə n d͡ʑ a ɡ a p ə r d a m a i a n p b b n ə p a l s ə t͡ɕ a r a t a n p a s a d a r m ə m b a w a p ə ɲ a k i t i t u k ə h a i t i
